{
  "library_id": "plantlens_standard_industrial_v1",
  "version": "1.0.0",
  "description": "Manufacturer-neutral industrial component templates for PlantLens assembly studio.",
  "components": [
    {
      "version": "1.0.0",
      "manufacturer_neutral": true,
      "tags": [
        "power",
        "dc",
        "supply"
      ],
      "recommended_sensors": [
        "voltage_sensor",
        "current_sensor"
      ],
      "hmi_render_hint": {
        "card_style": "industrial_compact",
        "show_ports": true
      },
      "safety_notes": [
        "Verify polarity before connecting DC loads.",
        "Do not exceed rated output current."
      ],
      "limits": {
        "max_output_current_a": 10,
        "nominal_voltage_v": 12
      },
      "component_type_id": "dc_power_supply",
      "display_name": "DC Power Supply",
      "category": "power_electrical",
      "description": "Regulated DC bus supply for bench and small-plant loads.",
      "physical_domain": "electrical",
      "ports": [
        {
          "port_id": "ac_in",
          "name": "AC Input",
          "direction": "input",
          "medium": "ac_power",
          "quantity_kind": "voltage",
          "nominal_range": {
            "min": 100,
            "max": 240
          },
          "compatibility_tags": [],
          "required": true
        },
        {
          "port_id": "dc_out",
          "name": "DC Output",
          "direction": "output",
          "medium": "dc_power",
          "quantity_kind": "voltage",
          "nominal_range": {
            "min": 11,
            "max": 13.5
          },
          "compatibility_tags": [
            "dc_12v",
            "dc_24v"
          ],
          "required": true
        },
        {
          "port_id": "sense_out",
          "name": "Sense Output",
          "direction": "output",
          "medium": "analog_signal",
          "quantity_kind": "voltage",
          "nominal_range": {
            "min": null,
            "max": null
          },
          "compatibility_tags": [],
          "required": true
        }
      ],
      "signal_templates": [
        {
          "signal_template_id": "supply_voltage",
          "name": "Supply Voltage",
          "quantity_kind": "voltage",
          "unit": "V",
          "expected_min": 11.5,
          "expected_max": 12.5,
          "sampling_hint_ms": 500,
          "quality_required": "GOOD",
          "source_port_id": "sense_out",
          "evidence_weight_default": 0.8,
          "alarm_thresholds": {
            "high": 13.0,
            "low": 11.0
          }
        },
        {
          "signal_template_id": "supply_current",
          "name": "Supply Current",
          "quantity_kind": "current",
          "unit": "A",
          "expected_min": 0,
          "expected_max": 10,
          "sampling_hint_ms": 500,
          "quality_required": "GOOD",
          "source_port_id": "dc_out",
          "evidence_weight_default": 0.8,
          "alarm_thresholds": {
            "high": 9.5
          }
        }
      ],
      "fault_modes": [
        {
          "fault_mode_id": "voltage_sag",
          "title": "Voltage Sag",
          "description": "Output voltage drops below nominal under load.",
          "severity": "warning",
          "root_asset_applicability": "self",
          "required_evidence": [
            {
              "signal_template_id": "supply_voltage",
              "relation": "low",
              "weight": 0.9,
              "required": true
            }
          ],
          "optional_evidence": [],
          "downstream_effects": [],
          "rejected_alternatives": [],
          "operator_actions": [
            "Measure load current and verify terminal torque.",
            "Reduce parallel loads before resetting supply."
          ],
          "safety_level": "caution"
        },
        {
          "fault_mode_id": "overvoltage",
          "title": "Overvoltage",
          "description": "Output exceeds safe operating range.",
          "severity": "critical",
          "root_asset_applicability": "self",
          "required_evidence": [
            {
              "signal_template_id": "supply_voltage",
              "relation": "high",
              "weight": 0.9,
              "required": true
            }
          ],
          "optional_evidence": [],
          "downstream_effects": [],
          "rejected_alternatives": [],
          "operator_actions": [
            "Isolate downstream loads immediately.",
            "Verify setpoint and regulator module before re-energizing."
          ],
          "safety_level": "isolate_before_touch"
        },
        {
          "fault_mode_id": "unstable_supply",
          "title": "Unstable Supply",
          "description": "Voltage oscillates or hunts under steady load.",
          "severity": "warning",
          "root_asset_applicability": "self",
          "required_evidence": [],
          "optional_evidence": [
            {
              "signal_template_id": "supply_voltage",
              "relation": "noisy",
              "weight": 0.9,
              "required": true
            }
          ],
          "downstream_effects": [],
          "rejected_alternatives": [],
          "operator_actions": [
            "Inspect input AC stability and DC filter capacitors.",
            "Check for intermittent ground path on output return."
          ],
          "safety_level": "caution"
        },
        {
          "fault_mode_id": "loose_terminal",
          "title": "Loose Terminal",
          "description": "Intermittent connection at output terminals.",
          "severity": "warning",
          "root_asset_applicability": "self",
          "required_evidence": [],
          "optional_evidence": [
            {
              "signal_template_id": "supply_voltage",
              "relation": "inconsistent",
              "weight": 0.9,
              "required": true
            }
          ],
          "downstream_effects": [],
          "rejected_alternatives": [],
          "operator_actions": [
            "De-energize and re-torque output lugs to manufacturer spec.",
            "Inspect for heat discoloration at terminal block."
          ],
          "safety_level": "caution"
        }
      ],
      "visual_asset": {
        "icon_kind": "inline_svg",
        "icon_svg": "<svg viewBox=\"0 0 64 64\" xmlns=\"http://www.w3.org/2000/svg\"><rect width=\"64\" height=\"64\" fill=\"#08111F\" rx=\"6\"/><rect x=\"8\" y=\"14\" width=\"48\" height=\"36\" rx=\"4\" fill=\"#0E1A2A\" stroke=\"#1CC8FF\" stroke-width=\"2\"/><path d=\"M20 32h12l-6-12 6 24 6-18h12\" fill=\"none\" stroke=\"#1CC8FF\" stroke-width=\"2\"/></svg>",
        "node_shape": "hex_card",
        "low_poly_shape": "box_with_terminals",
        "accent_role": "power",
        "port_layout": {
          "left": [
            "ac_in"
          ],
          "right": [
            "dc_out",
            "sense_out"
          ],
          "top": [],
          "bottom": [
            "mount"
          ]
        },
        "size_hint": {
          "width": 180,
          "height": 96
        },
        "preview_label": "DC Supply",
        "render_tokens": {
          "base": "industrial_dark",
          "accent": "power_cyan",
          "danger": "fault_red"
        }
      }
    },
    {
      "version": "1.0.0",
      "manufacturer_neutral": true,
      "tags": [
        "power",
        "converter",
        "dc"
      ],
      "recommended_sensors": [
        "voltage_sensor",
        "current_sensor",
        "temperature_sensor"
      ],
      "hmi_render_hint": {
        "card_style": "industrial_compact",
        "show_ports": true
      },
      "safety_notes": [],
      "limits": {
        "max_input_v": 48,
        "max_output_a": 5
      },
      "component_type_id": "dc_dc_converter",
      "display_name": "DC-DC Converter",
      "category": "power_electrical",
      "description": "Step-up or step-down DC conversion stage between bus segments.",
      "physical_domain": "electrical",
      "ports": [
        {
          "port_id": "dc_in",
          "name": "DC Input",
          "direction": "input",
          "medium": "dc_power",
          "quantity_kind": "voltage",
          "nominal_range": {
            "min": 10,
            "max": 48
          },
          "compatibility_tags": [],
          "required": true
        },
        {
          "port_id": "dc_out",
          "name": "DC Output",
          "direction": "output",
          "medium": "dc_power",
          "quantity_kind": "voltage",
          "nominal_range": {
            "min": null,
            "max": null
          },
          "compatibility_tags": [
            "dc_12v",
            "dc_24v"
          ],
          "required": true
        },
        {
          "port_id": "enable_in",
          "name": "Enable",
          "direction": "input",
          "medium": "digital_signal",
          "quantity_kind": "boolean_state",
          "nominal_range": {
            "min": null,
            "max": null
          },
          "compatibility_tags": [],
          "required": false
        }
      ],
      "signal_templates": [
        {
          "signal_template_id": "converter_input_v",
          "name": "Input Voltage",
          "quantity_kind": "voltage",
          "unit": "V",
          "expected_min": 10,
          "expected_max": 48,
          "sampling_hint_ms": 500,
          "quality_required": "GOOD",
          "source_port_id": "dc_in",
          "evidence_weight_default": 0.8,
          "alarm_thresholds": {}
        },
        {